{
  "metadata": {
    "title": "Accelerating DETR Convergence via Semantic-Aligned Matching",
    "conference_name": "Proceedings of the IEEE/CVF Conference on Computer Vision and Pattern Recognition (CVPR)",
    "publication_title": "CVPR 2022",
    "keywords": ["DETR", "transformer", "object detection"]
  },
  "input_tags": ["Transformer", "Object detection", "Training"],
  "remove_tags": ["Transformer", "Object detection", "Training"],
  "add_tags": ["ai_task:detection", "field:CS/AI/CV", "field:CS/AI/DL", "model:DL/Transformer"],
  "suggest_tags": [],
  "provenance": { "generated_at": "2026-02-12T00:00:00Z" },
  "warnings": [],
  "error": null
}

